{
  "generated_at": "2026-05-04T17:17:57.544Z",
  "bundle_path": "D:\\Users\\HCI_lab\\Desktop\\github\\飞书比赛\\data\\fixtures\\feishu_cli_case_05_desktop_robot",
  "output_dir": "D:\\Users\\HCI_lab\\Desktop\\github\\飞书比赛\\data\\outputs\\demo\\case05\\bot_smoke_2",
  "selected_meeting_id": "MTG-CASE-05-01",
  "front_status": "collected",
  "completeness_status": "degraded",
  "degrade_reasons": [
    "Base 历史 缺失"
  ],
  "blocking_reasons": [],
  "meeting_selection_attempts": [
    {
      "meeting_id": "MTG-CASE-05-01",
      "status": "collected",
      "completeness_status": "degraded",
      "blocking_reasons": []
    }
  ],
  "fallback_used": false,
  "hard_metrics_status": {
    "sample_counts": {
      "task_count": 30,
      "risk_count": 5,
      "meeting_count": 3,
      "chat_message_count": 50,
      "calendar_event_count": 3,
      "contact_count": 5,
      "base_history_count": 0
    },
    "metric_count": 15,
    "available_count": 15,
    "degraded_count": 0,
    "no_sample_count": 0
  },
  "capability_status": "blocked",
  "report_status": "blocked",
  "human_review_item_count": 0,
  "files": {
    "task_request": "D:\\Users\\HCI_lab\\Desktop\\github\\飞书比赛\\data\\outputs\\demo\\case05\\bot_smoke_2\\task_request.json",
    "orchestration_state": "D:\\Users\\HCI_lab\\Desktop\\github\\飞书比赛\\data\\outputs\\demo\\case05\\bot_smoke_2\\orchestration_state.json",
    "input_completeness_report": "D:\\Users\\HCI_lab\\Desktop\\github\\飞书比赛\\data\\outputs\\demo\\case05\\bot_smoke_2\\input_completeness_report.json",
    "raw_payload": "D:\\Users\\HCI_lab\\Desktop\\github\\飞书比赛\\data\\outputs\\demo\\case05\\bot_smoke_2\\raw_payload.json",
    "history_bundle": "D:\\Users\\HCI_lab\\Desktop\\github\\飞书比赛\\data\\outputs\\demo\\case05\\bot_smoke_2\\history_bundle.json",
    "meeting_fact_pack": "D:\\Users\\HCI_lab\\Desktop\\github\\飞书比赛\\data\\outputs\\demo\\case05\\bot_smoke_2\\meeting_fact_pack.json",
    "data_quality_report": "D:\\Users\\HCI_lab\\Desktop\\github\\飞书比赛\\data\\outputs\\demo\\case05\\bot_smoke_2\\data_quality_report.json",
    "hard_metrics_result": "D:\\Users\\HCI_lab\\Desktop\\github\\飞书比赛\\data\\outputs\\demo\\case05\\bot_smoke_2\\hard_metrics_result.json",
    "evaluation_plan": "D:\\Users\\HCI_lab\\Desktop\\github\\飞书比赛\\data\\outputs\\demo\\case05\\bot_smoke_2\\evaluation_plan.json",
    "management_reviewer_result": "D:\\Users\\HCI_lab\\Desktop\\github\\飞书比赛\\data\\outputs\\demo\\case05\\bot_smoke_2\\management_reviewer_result.json",
    "risk_behavior_auditor_result": "D:\\Users\\HCI_lab\\Desktop\\github\\飞书比赛\\data\\outputs\\demo\\case05\\bot_smoke_2\\risk_behavior_auditor_result.json",
    "coordination_lens_result": "D:\\Users\\HCI_lab\\Desktop\\github\\飞书比赛\\data\\outputs\\demo\\case05\\bot_smoke_2\\coordination_lens_result.json",
    "capability_assessor_result": "D:\\Users\\HCI_lab\\Desktop\\github\\飞书比赛\\data\\outputs\\demo\\case05\\bot_smoke_2\\capability_assessor_result.json",
    "report_result": "D:\\Users\\HCI_lab\\Desktop\\github\\飞书比赛\\data\\outputs\\demo\\case05\\bot_smoke_2\\report_result.json"
  }
}